,Unnamed: 0,Name,Address,BarcodeID,location,lat,lng
0,0,Arun,"Lunkad Queensland,Mhada Colony, Viman Nagar, Pune, Maharashtra 411014",645458964388,"(18.568976, 73.9104313)",18.568976, 73.9104313
1,1,Kunal,"Mystique Moods Society,232, New Airport Rd, Air Force Area, Mhada Colony, Sanjay Park, Pune, Maharashtra 411014",357791077845,"(18.5692631, 73.9072675)",18.5692631, 73.9072675
2,2,Saniya,"Konark Campus,S. No. 230, A/1, New Airport Rd, Mhada Colony, Viman Nagar, Pune, Maharashtra 411014",368533636950,"(18.5708251, 73.9109758)",18.5708251, 73.9109758
3,3,Sumit,"Emerald Residency,  Anand Vidya Niketan High School Rd Sainik Nagar, Clover Park, Viman Nagar, Pune, Maharashtra 411014 ",367903052756,"(18.5673146, 73.9176804)",18.5673146, 73.9176804
4,4,Anooj,"Mandke ARMAAN Premium Apartments,7, Rajiv Nagar South, Konark Nagar, Mhada Colony, Viman Nagar, Pune, Maharashtra 411014",384324736305,"(18.568839, 73.91358989999999)",18.568839, 73.91358989999999
5,5,Pratiksha,"Siddhivinayak Pride, 411014, Konark Nagar, Mhada Colony, Viman Nagar, Pune, Maharashtra 411014",981035797783,"(18.5694909, 73.9119977)",18.5694909, 73.9119977
6,6,Denisa,"Mhada ColonyViman NagarPune, Maharashtra 411014 ",846900137460,"(18.5734634, 73.9109977)",18.5734634, 73.9109977
7,7,Diviyam,"Rohan Mithila 2 Co-operative Housing Society,New Airport Rd, Survey Number 235, Mhada Colony, Viman Nagar, Pune, Maharashtra 411014",852121400706,"(18.5721068, 73.9067426)",18.5721068, 73.9067426
8,8,Suraj ,"Puru Society Road Survey Number 235, Puru Society, Sanjay Park Pune, Maharashtra 411006 ",853360970238,"(18.5729076, 73.9017355)",18.5729076, 73.9017355
9,9,Shreyansh,"Sky Belvedere, New Airport Rd, Opp Symbiosis Law College, Survey Number 235, Mhada Colony, Viman Nagar, Pune, Maharashtra 411014",908938606230,"(18.577277, 73.903098)",18.577277, 73.903098
10,10,Arbind,"D2 Clover Park, Viman Nagar, Pune, Maharashtra 411014 ",317551485609,"(18.567936, 73.90933199999999)",18.567936, 73.90933199999999
11,11,Prabhat,"Nature Mosaics, Riddhi Towers, Clover Park, Viman Nagar, Pune, Maharashtra 411014",180038548182,"(18.5676052, 73.91518620000001)",18.5676052, 73.91518620000001
12,12,Appu,"Air Force Campus, Viman Nagar,Pune, Maharashtra 411014 ",724733840649,"(18.5713497, 73.91981609999999)",18.5713497, 73.91981609999999
13,13,James,"Oakwood Apartment,Near CCD, Ganga Hamlet, Sakore Nagar, Kalyani Nagar, Pune, Maharashtra 411014",424893342075,"(18.5639734, 73.9107394)",18.5639734, 73.9107394
14,14,Ankit,"Lunkad Greenland,Satyam King Marg, Konark Nagar, Clover Park, Viman Nagar, Pune, Maharashtra 411014",949911060676,"(18.5665707, 73.9132712)",18.5665707, 73.9132712
15,15,Aarav,"Symbiosis International School,Gate No. 3, Symbiosis Viman Nagar Campus, Off., New Airport Road, Viman Nagar, Clover Park, Viman Nagar, Pune, Maharashtra 411014",873991901481,"(18.5654227, 73.90741919999999)",18.5654227, 73.90741919999999
16,16,Vivaan,"Kothari Orchid Sakore Nagar, Viman Nagar Pune, Maharashtra 411014",897896428118,"(18.5640405, 73.9077366)",18.5640405, 73.9077366
17,17,Aditya,"127 Sakore Nagar, Viman Nagar Pune, Maharashtra 411014",537136172161,"(18.5569937, 73.90746109999999)",18.5569937, 73.90746109999999
18,18,Amrit ,"Amrit Bhavan,B No R58 Parkland Society behind Hotel Hyatt Regency 411014, Sakore Nagar, Viman Nagar, Pune, Maharashtra 411014",695295561376,"(18.5632802, 73.91222259999999)",18.5632802, 73.91222259999999
19,19,Vihaan,"Nyati Millennium,Datta Mandir Chamber,Viman Nagar, Viman Nagar Rd, Clover Park, Viman Nagar, Pune, Maharashtra 411014",756457351381,"(18.564464, 73.91394199999999)",18.564464, 73.91394199999999
20,20,Akhila,"Anand Vidya Niketan High School Rd Konark Nagar, Clover Park, Viman Nagar Pune, Maharashtra 411014",260682006185,"(18.5680642, 73.9126619)",18.5680642, 73.9126619
21,21,Amrita,"Air Force Campus  Viman Nagar Pune, Maharashtra 411014",827134322272,"(18.5713497, 73.91981609999999)",18.5713497, 73.91981609999999
22,22,Cachari,"Survey No 226,New Airport Rd, Survey Number 235, Mhada Colony, Viman Nagar, Pune, Maharashtra 411006",899926947887,"(18.5768495, 73.9075679)",18.5768495, 73.9075679
23,23,Aabhass,"Mudliar Classes,Plot no 41, Lane 2C, Survey Number 235, Sanjay Park, Pune, Maharashtra 411006",201677047158,"(18.5709922, 73.90265959999999)",18.5709922, 73.90265959999999
24,24,Faryad,"Nagar Road Ward Office,Survey No.30, 7, Nagar Rd, Ramwadi, Viman Nagar, Pune, Maharashtra 411014",936882079537,"(18.5570334, 73.9074778)",18.5570334, 73.9074778
